{
  "updated_at": "2026-04-08T20:39:26+08:00",
  "source": "input_data/bingshan_index.xlsx + input_data/new_house.xlsx",
  "stale_after_minutes": 1440,
  "status": "ok",
  "status_message": "已接入 2 个栏目，待补充 0 个栏目，加载失败 0 个栏目。",
  "board_id": "real-estate-high-frequency",
  "title": "地产高频",
  "description": "地产高频板块展示二手房高频跟踪，以及基于手动维护文件生成的新房价格与销售同比图表。",
  "sections": [
    {
      "section_id": "second-hand-housing",
      "title": "二手房",
      "description": "从手动更新的 bingshan_index.xlsx 中重建二手房价格月环比和活跃度图表，每次替换文件后重新运行 ETL 即可同步更新。",
      "status": "ready",
      "charts": [
        {
          "chart_id": "second-hand-price-mom",
          "title": "二手房价格月环比",
          "description": "冰山统计的全国、一线、强二线、弱二线和三线城市的二手房价格月环比走势。",
          "chart_type": "line",
          "x_axis_label": "周度时间",
          "latest_label": "数据截至",
          "latest_time_text": "2026-04-05",
          "show_point_markers": false,
          "latest_changes": [],
          "labels": [
            "2023-04-09",
            "2023-04-16",
            "2023-04-23",
            "2023-04-30",
            "2023-05-07",
            "2023-05-14",
            "2023-05-21",
            "2023-05-28",
            "2023-06-04",
            "2023-06-11",
            "2023-06-18",
            "2023-06-25",
            "2023-07-02",
            "2023-07-09",
            "2023-07-16",
            "2023-07-23",
            "2023-07-30",
            "2023-08-06",
            "2023-08-13",
            "2023-08-20",
            "2023-08-27",
            "2023-09-03",
            "2023-09-10",
            "2023-09-17",
            "2023-09-24",
            "2023-10-01",
            "2023-10-08",
            "2023-10-15",
            "2023-10-22",
            "2023-10-29",
            "2023-11-05",
            "2023-11-12",
            "2023-11-19",
            "2023-11-26",
            "2023-12-03",
            "2023-12-10",
            "2023-12-17",
            "2023-12-24",
            "2023-12-31",
            "2024-01-07",
            "2024-01-14",
            "2024-01-21",
            "2024-01-28",
            "2024-02-04",
            "2024-02-11",
            "2024-02-18",
            "2024-02-25",
            "2024-03-03",
            "2024-03-10",
            "2024-03-17",
            "2024-03-24",
            "2024-03-31",
            "2024-04-07",
            "2024-04-14",
            "2024-04-21",
            "2024-04-28",
            "2024-05-05",
            "2024-05-12",
            "2024-05-19",
            "2024-05-26",
            "2024-06-02",
            "2024-06-09",
            "2024-06-16",
            "2024-06-23",
            "2024-06-30",
            "2024-07-07",
            "2024-07-14",
            "2024-07-21",
            "2024-07-28",
            "2024-08-04",
            "2024-08-11",
            "2024-08-18",
            "2024-08-25",
            "2024-09-01",
            "2024-09-08",
            "2024-09-15",
            "2024-09-22",
            "2024-09-29",
            "2024-10-06",
            "2024-10-13",
            "2024-10-20",
            "2024-10-27",
            "2024-11-03",
            "2024-11-10",
            "2024-11-17",
            "2024-11-24",
            "2024-12-01",
            "2024-12-08",
            "2024-12-15",
            "2024-12-22",
            "2024-12-29",
            "2025-01-05",
            "2025-01-12",
            "2025-01-19",
            "2025-01-26",
            "2025-02-02",
            "2025-02-09",
            "2025-02-16",
            "2025-02-23",
            "2025-03-02",
            "2025-03-09",
            "2025-03-16",
            "2025-03-23",
            "2025-03-30",
            "2025-04-06",
            "2025-04-13",
            "2025-04-20",
            "2025-04-27",
            "2025-05-04",
            "2025-05-11",
            "2025-05-18",
            "2025-05-25",
            "2025-06-01",
            "2025-06-08",
            "2025-06-15",
            "2025-06-22",
            "2025-06-29",
            "2025-07-06",
            "2025-07-13",
            "2025-07-20",
            "2025-07-27",
            "2025-08-03",
            "2025-08-10",
            "2025-08-17",
            "2025-08-24",
            "2025-08-31",
            "2025-09-07",
            "2025-09-14",
            "2025-09-21",
            "2025-09-28",
            "2025-10-05",
            "2025-10-12",
            "2025-10-19",
            "2025-10-26",
            "2025-11-02",
            "2025-11-09",
            "2025-11-16",
            "2025-11-23",
            "2025-11-30",
            "2025-12-07",
            "2025-12-14",
            "2025-12-21",
            "2025-12-28",
            "2026-01-04",
            "2026-01-11",
            "2026-01-18",
            "2026-01-25",
            "2026-02-01",
            "2026-02-08",
            "2026-02-15",
            "2026-02-22",
            "2026-03-01",
            "2026-03-08",
            "2026-03-15",
            "2026-03-22",
            "2026-03-29",
            "2026-04-05"
          ],
          "series": [
            {
              "series_id": "second-hand-price-mom-全国",
              "label": "全国",
              "unit": "%",
              "y_axis_id": "left",
              "span_gaps": false,
              "values": [
                -0.39,
                -0.44,
                -0.48,
                -0.55,
                -0.56,
                -0.66,
                -0.73,
                -0.73,
                -0.9,
                -0.94,
                -0.97,
                -0.99,
                -0.96,
                -0.93,
                -0.9,
                -0.94,
                -0.88,
                -0.83,
                -0.77,
                -0.74,
                -0.79,
                -0.88,
                -0.93,
                -0.91,
                -0.91,
                -0.87,
                -0.85,
                -1.02,
                -1.06,
                -1.18,
                -1.35,
                -1.34,
                -1.36,
                -1.36,
                -1.28,
                -1.2,
                -1.11,
                -1.0,
                -1.0,
                -0.96,
                -0.96,
                -0.97,
                -0.85,
                -0.73,
                -0.49,
                -0.34,
                -0.59,
                -0.95,
                -1.26,
                -1.61,
                -1.87,
                -1.85,
                -1.42,
                -1.35,
                -1.4,
                -1.35,
                -1.35,
                -1.47,
                -1.48,
                -1.36,
                -1.65,
                -1.52,
                -1.39,
                -1.25,
                -1.34,
                -1.11,
                -1.13,
                -1.19,
                -1.17,
                -1.3,
                -1.14,
                -1.17,
                -1.17,
                -1.56,
                -1.59,
                -1.71,
                -1.63,
                -1.64,
                -1.03,
                -1.07,
                -1.05,
                -1.04,
                -1.56,
                -1.23,
                -1.0,
                -0.81,
                -0.19,
                -0.43,
                -0.49,
                -0.54,
                -0.54,
                -0.51,
                -0.44,
                -0.36,
                -0.23,
                -0.09,
                -0.25,
                -0.74,
                -1.05,
                -1.35,
                -1.49,
                -1.38,
                -1.34,
                -1.25,
                -1.15,
                -0.99,
                -0.96,
                -1.01,
                -1.04,
                -1.0,
                -1.01,
                -1.03,
                -1.02,
                -1.07,
                -1.09,
                -1.14,
                -1.12,
                -1.27,
                -1.31,
                -1.44,
                -1.47,
                -1.39,
                -1.36,
                -1.17,
                -1.19,
                -1.14,
                -1.18,
                -1.27,
                -1.32,
                -1.36,
                -1.28,
                -1.26,
                -1.26,
                -1.27,
                -1.42,
                -1.45,
                -1.46,
                -1.44,
                -1.43,
                -1.48,
                -1.41,
                -1.41,
                -1.33,
                -1.12,
                -1.0,
                -0.84,
                -0.65,
                -0.55,
                -0.41,
                -0.2,
                -0.02,
                0.04,
                -0.14,
                -0.32,
                -0.51,
                -0.52,
                -0.36
              ]
            },
            {
              "series_id": "second-hand-price-mom-一线",
              "label": "一线",
              "unit": "%",
              "y_axis_id": "left",
              "span_gaps": false,
              "values": [
                -0.13,
                -0.19,
                -0.28,
                -0.31,
                -0.38,
                -0.53,
                -0.64,
                -0.6,
                -0.87,
                -0.9,
                -0.96,
                -1.08,
                -0.93,
                -0.91,
                -0.87,
                -0.91,
                -0.87,
                -0.71,
                -0.57,
                -0.51,
                -0.5,
                -0.58,
                -0.57,
                -0.56,
                -0.54,
                -0.55,
                -0.64,
                -0.83,
                -0.93,
                -1.1,
                -1.3,
                -1.39,
                -1.52,
                -1.56,
                -1.53,
                -1.39,
                -1.26,